<?xml version="1.0" encoding="utf-8" ?>
<SpectraCamSimConfig xmlns:xsi="http://www.w3.org/2001/XMLSchema-instance"
  xsi:noNamespaceSchemaLocation="..\XSD\spectracamsim_config.xsd">
    <module_version major_revision="1" minor_revision="0" incr_revision="0"/>
    <DeviceSetting>
        <Feature>
            <!-- feature name, e.g BPS, IPE, MFXR, BayerToYUV, YUV2JPEG â€¦ -->
            <Name>MFXR</Name>
            <!-- number of frames for MFXR or video -->
            <FrameCount>5</FrameCount>
            <!-- Sensor ID-->
            <SensorID>0</SensorID>
        </Feature>
        <InputSetting>
            <!--InputFolder: Input folder is now fixed to - data/vendor/camera -->
            <InputFolder>/data/vendor/camera/</InputFolder>
            <ImageFile>latest.raw</ImageFile>
            <ISPConfig>/data/vendor/camera/isp_config.xml</ISPConfig>
            <MetaConfig>/data/vendor/camera/meta_config.xml</MetaConfig>
            <StreamConfig>/data/vendor/camera/stream_config.xml</StreamConfig>
        </InputSetting>
        <OutputSetting>
            <!--OutputFolder: Output folder is now fixed to - data/vendor/camera/output-->
            <OutputFolder>/data/vendor/camera/output</OutputFolder>
            <OutputPrefix>ots</OutputPrefix>
        </OutputSetting>
    </DeviceSetting>
    <!-- 0: None;  1: Snapshot;  2: Video;  3: MFNR  4: QLL -->
    <UseCase>1</UseCase>
    <TuningModeSelector>
        <SubModeValue0>0</SubModeValue0>
        <SubModeValue1>0</SubModeValue1>
        <ModeUsecaseSubModeType>0</ModeUsecaseSubModeType>
        <ModeFeature1SubModeType>0</ModeFeature1SubModeType>
        <ModeFeature2SubModeType>0</ModeFeature2SubModeType>
        <ModeSceneSubModeType>0</ModeSceneSubModeType>
        <ModeEffectSubModeType>0</ModeEffectSubModeType>
    </TuningModeSelector>
    <!-- 0x01: IFE;  0x02:  BPS;   0x04:  PPS;   0x08:  NPS -->
    <!-- i.e. IFE+PPS+NPS:  0x0D;  BPS+PPS+NPS:  0x0E; -->
    <RunPipeline>0x2</RunPipeline>
    <!-- 0x01: PreFusion;  0x02:  Fusion;   0x04:  PostFusion  -->
    <MFHDRStageConfig>0x1</MFHDRStageConfig>
    <QLLStageConfig>0x1</QLLStageConfig>
    <ParamParserExeFile>..\Simulator\Spectra480\ParameterParser.exe</ParamParserExeFile>
    <!-- None, ABF, LSC, ASF, BLS, GRA, CC, 2DLUT, GIC, LSC, BLS, WB, Demo, CC -->
    <PerModule>None</PerModule>
    <MFNRStageConfig>0xf</MFNRStageConfig>
    <InputSetting>
        <!-- 0: RAW;  1: YUV -->
        <ImageFormat>0</ImageFormat>
        <ImageFile>..\Input\MCC_D65.raw</ImageFile>
        <TFIFile></TFIFile>
        <InputFolder>..\Input\</InputFolder>
        <ExpSequence>SLM</ExpSequence>
        <ManualLoadFile></ManualLoadFile>
    </InputSetting >
    <EarlyExit>
        <Enable>0</Enable>
        <ModulePipeline>0</ModulePipeline>
        <Module>ABF</Module>
    </EarlyExit>
    <ISPConfig>..\TestData\isp_config.xml</ISPConfig>
    <MetaConfig>..\TestData\meta_config.xml</MetaConfig>
    <StreamConfig>..\TestData\stream_config.xml</StreamConfig>
    <QLLCalcFrameConfig></QLLCalcFrameConfig>
    <SchemaDir>..\Schema</SchemaDir>
    <ChromatixHeaderXMLDir>..\TestData\Chromatix</ChromatixHeaderXMLDir>
    <DataStoreFile>..\TestData\Config\dump_config.xml</DataStoreFile>
    <SchemaValidation>1</SchemaValidation>    
    <OutputSetting>
        <!-- 1: BMP;  2: YUV;  3: BMP+YUV -->
        <ImageFormat>2</ImageFormat>
        <OutputFolder>..\Simulation\Default\2018_5_23_12_34_0\</OutputFolder>
        <OutputPrefix>out_</OutputPrefix>
        <RegisterDump>1</RegisterDump>
        <IntermediateSetting>
            <Enable>1</Enable>
            <statsDump>0</statsDump>
        </IntermediateSetting>
        <RegisterDumpOnlyModeCfg>
            <AWBMode>
                <Enable>1</Enable>
                <!-- 0: disable 1: enable register dump for AWB ( IPE CC, gamma, 2DLUT only ) -->
                <BPSCCEnable>0</BPSCCEnable>
                <!-- additionally enable BPS CC -->
            </AWBMode>
        </RegisterDumpOnlyModeCfg>
    </OutputSetting>
    <CustomTriggerModule>0</CustomTriggerModule>
</SpectraCamSimConfig>
